<?xml version="1.0" encoding="UTF-8"?>
<resources xmlns="http://simject.org/xml/ns/resources"
	xmlns:xsi="http://www.w3.org/2001/XMLSchema-instance"
	xsi:schemaLocation="http://simject.org/xml/ns/resources http://simject.org/xml/ns/resources/resources_1_0.xsd"
	version="1.0">
	<resource type="org.simject.test.dummy.TestClass" />
	<resource type="org.simject.test.dummy.TestInterface"
		target="org.simject.test.dummy.TestImpl" />
	<resource type="org.simject.test.dummy.TestRemoteInterface"
		target="xml:http://localhost:8080/demo/remote/org.simject.test.dummy.TestRemoteInterface" />
	<resource type="javax.persistence.EntityManager" name="org.simject.demo">
		<property name="hibernate.connection.driver_class" value="com.mysql.jdbc.Driver" />
		<property name="hibernate.connection.username" value="root" />
		<property name="hibernate.connection.password" value="root" />
		<property name="hibernate.connection.url" value="jdbc:mysql://localhost/demo" />
		<property name="hibernate.format_sql" value="true" />
		<property name="dialect" value="org.hibernate.dialect.MySQLDialect" />
		<property name="hibernate.hbm2ddl.auto" value="create-drop" />
	</resource>
</resources>